Feature Description,Release Version,Release Date,
"Other is now included as an option when selecting languages for simultaneous interpretation. This update doesn't yet support indicating a specific custom language. The option simply states Other, which allows users to assign it to interpreters who are speaking languages that aren't part of the standard list.",version 42.8,Aug-22,
"In this update we’re removing Verify Rich Media Player from the Help menu in Webex Meetings, Webinars, Events (classic), and Training, as this option is now obsolete.",version 42.8,Aug-22,
"When you join as an attendee, you won’t need to re-enter your email or registration ID before joining a webinar in the following cases: If you have a Webex account on the current site and you received a join link after the host invited you from the webinar or you registered for the webinar and are approved by the host; and If you already joined or registered for a webinar meeting earlier and the user name and mail is received from the cookie. This applies to webinar with webcast view.",version 42.8,Aug-22,
"When you register for a webinar, you’ll see the following updates: If you're approved, the you’ll see more meaningful actions, for example, join button, add the webinar to calendar, and download material, and while you enter your information and click Submit, you’ll not see the Submit button while your approval is pending to avoid confusion for double registering. If your submission is approved, then you'll see the Join instead of the Submit button, and you can download webinar materials if the host has it setup.",version 42.8,Aug-22,
You'll see a webinars promotion dialogue and message bar in classic event.,version 42.8,Aug-22,
"For on on-premises registered video devices and cloud registered DX, SX, and MX series video devices, you can hide people who have disabled their video. This allows for a more engaging video experience, similar to the same capability that exists in the app. When someone without a video becomes the active speaker, they are shown with an active speaker bubble on the screen with their name. After they stop talking, the bubble disappears. People on their devices can switch this behavior using #5 on their numeric keypad interface.",version 42.8,Aug-22,
"If you join a meeting or call from a paired Cisco room, desk devices, or mobile you can change the layout on the device just from the Webex App.",version 42.8,Aug-22,
Multiple recordings are available to download from the web portal by navigating to My Recordings > Recordings in your Webex site.,version 42.8,Aug-22,
"This feature allows you to log yourselves out of all instances of your Webex Meetings App. Removing Webex Refresh Tokens, forces you to sign out on any Webex Meetings App instance that you are signed into.",version 42.8,Aug-22,
"The administrator settings for enabling the Webex Assistant and enabling the Captions & Highlights panel can now be set independently. For example, administrators can disable the Captions & Highlights panel while keeping Webex Assistant enabled; in that case, the Captions & Highlights panel will not show in meetings, except when the host turns on Webex Assistant.",version 42.8,Aug-22,
Provide customers with the ability to answer customizable registration questions using the API for both Meetings and Webinars.,version 42.8,Aug-22,
We now provide the ability for administrators and compliance officers to retrieve all recordings for a site. This is possible using the new /admin/recordings endpoint. With this feature we further strengthen the security and compliance of our platform.,version 42.8,Aug-22,
"Currently, if you are using Meetings API, you can choose what registration questions are required to be answered for an attendee to register for meeting or a webinar. These registration questions can be chosen out of the standard list of registration questions provided by Webex. In this update, the APIs are enhanced, to allow you to retrieve list of custom questions that are created on Webex sites as well as choose which of these custom created questions are required for registration when scheduling a meeting or a webinar.",version 42.8,Aug-22,
"The Webex Scheduler now supports Government Community Cloud (GCC) and GCC High users to schedule, edit, and delete Webex meeting on Outlook. To apply this feature, site administrators need to choose either GCC or GCC High based on the Microsoft account in their organization, and authorize the administrators to consent to Webex.",version 42.8,Aug-22,
Webex Meetings users can view their upcoming meetings after connecting their iPhone to Apple CarPlay dashboard and can join the meeting with one click.,version 42.7,Jul-22,
"With Windows 11, Webex Meetings now allows you to share applications directly from the task bar. This also includes the Mute and Unmute from taskbar. Hover over the application in the task bar and a pop-up appears with the option to share the application in Webex.",version 42.7,Jul-22,
"Users on on-premises registered video devices such as cloud DX, SX, and MX, can now see presenters in front of shared content.",version 42.7,Jul-22,
"The host can upload a music file in the scheduling process, when the practice session starts, this music file play by default for the attendees. Attendees can mute the music as needed.",version 42.7,Jul-22,
"In the desktop app for Meetings and Webinars, we’ve consolidated the Audio & Video Statistics into Meeting settings. These settings can be found in the Statistics tab.",version 42.7,Jul-22,
"The host can now edit the message that attendees see when practice session is in progress. Hosts can customize the message content and location in the scheduling process. When the practice session starts, this message is shown to the attendees.",version 42.7,Jul-22,
"Currently, Webex doesn’t supports languages that are read right-to-left (RTL). In this update, we’re adding support for RTL languages, starting with Arabic and Hebrew.",version 42.7,Jul-22,
"After a webinar ends, the attendance report from webinars with webcast view also contain the attendees' email address column, making it easy to accurately identify who the attendees are, and join with other report.",version 42.7,Jul-22,
"Similar to desktop and iOS, Android now supports MP4 virtual background. GIF is currently not support for Android.",version 42.7,Jul-22,
"We’ve innovated the legacy site administration configuration and moved site administration options to Control Hub. The administrator can go to administration activities in Control Hub to audit these activities. In this update, it covers all options relevant to Webex Meetings and Webinars in Control Hub managed sites.",version 42.7,Jul-22,
"The existing site administration setting for Send notification email now controls the email notification flow for both recording-generated emails as well as other post-meeting content emails (highlights and meeting transcript). With this setting, all post-meeting emails can be enabled or disabled using a single toggle.",version 42.7,Jul-22,
"This compliance feature allows IT administrators to block their company users from using VoIP to join meetings. The IT administrators can choose a particular user, group of users, and organization level external meeting setting for whom these settings would apply. This new setting is a part of the Control Hub settings template.",version 42.7,Jul-22,
"Webex webinars now allows the site administrators to configure, if the dial-in users need to enter a numeric password ID, in addition to the mandatory access code. Previously, it enforced dial-in in users to enter both numeric password and access code. Going forward the numeric password is configurable by the site administrators.",version 42.7,Jul-22,
"Grid view in Meetings, Webinars, and Events (classic) can now support up to 81 simultaneous videos per page! This gives you the ability to see even more thumbnail videos in large meetings. You can set your preferred maximum numbers of videos to show in grid view in the Meetings settings. The actual number of videos may be limited by your screen resolution or window size.",version 42.6,Jun-22,
Webinar series brings a simple registration experience where registrants can select and register for multiple webinars at once. Webinar series owners can add webinars to a series. They can invite their team to a series as contributors. Contributors can also add their webinars to a series and manage the series. All webinars in the series will use the same registration form. The webinar owners manage registration approval for the webinars that they own.,version 42.6,Jun-22,
"Third-party apps opened in Webex Meetings can now be opened in stage, not just in the Apps panel. Some apps are better used in full screen so now users can open those apps in stage view.",version 42.6,Jun-22,
"To ensure you have a good support experience when faced with join meeting issues, we are adding a few more details to the error message dialogs shown to the user. With the next update, you can see a meaningful high level description of the error a user has run into. A meeting details component contains any other details surrounding the error including the error code. You also have the option to Send Problem Report to Cisco for the issue. You can share these details including the error code when logging a TAC case.",version 42.6,Jun-22,
You can now scale the Share content window to make it bigger. This makes it easier to see more of the windows you have open without having to scroll.,version 42.6,Jun-22,
Mobile users can now view their network quality status in the indicator center during a meeting.,version 42.6,Jun-22,
"IT administrators can now enable the embedded apps for a group of users. To enable the app to a group of users, login to Control Hub, navigate to the Apps > Embedded Apps. Then choose an app and enable it for the selected groups.",version 42.6,Jun-22,
Participants connecting to a meeting hosted by Webex for Government can now easily tell what meeting platform they are connected to.,version 42.6,Jun-22,
"For meetings with Webex Assistant or closed captions, the host can now select the spoken language (transcription) of the meeting in four different languages: French, German, and Spanish, in addition to the existing English. If users wants transcription in more languages, as well as translation capabilities, that can be obtained with the real-time translation add-on, which enables spoken language (transcription) in 13 languages, and caption language (translation) in 100+ languages.",version 42.5,May-22,
"We're excited to introduce People Focus—a new way to use Grid view, that maximizes screen space by using AI to dynamically crop videos to focus on the individual, rather than their surroundings. This gives you a better face-to-face experience with the people you are meeting with, regardless of how the person is positioned in front of their camera, making you feel more connected. Click Layout to turn on People Focus.",version 42.5,May-22,
Users can now change the size of the closed captions (CC) box to show more or fewer lines.,version 42.5,May-22,
"We're excited to announce that the Webex Meetings web app is now available for download as a Progressive Web App (PWA) for ChromeOS in the Google Play store. This makes it easy for Chromebook users to access Meetings directly from their desktop, without having to go through the browser. Similarly, this provides you with more flexibility to manage services and apps for your users.",version 42.5,May-22,
We are introducing the Move Meeting to Mobile feature where users can scan the QR code using their mobile camera and move their meeting to Webex Meetings mobile app without disrupting or disconnecting the meeting.,version 42.5,May-22,
The goal is to ensure that all attendees are able to participate in the meeting effectively and use all the available features. We’re giving you the option to update your app before you join the meeting. Then you’ll be sure to have the latest features for an optimal meetings experience.,version 42.5,May-22,
"Today, organizations or sites with licenses of 10,000 and below can schedule email reminders to attendees. Starting with the 42.5 update, organizations or sites who have more than 10,000 licenses can also schedule email reminders. To support a large volume of emails, the reminder can be scheduled to be sent at least 12 hours before the start time. This feature also supports webcast view for attendees.",version 42.5,May-22,
"Now, when you go to register for an upcoming meeting, you see the meeting title, time, and host. This helps make it clear what meeting you're registering for. We've also removed the meeting password in the Registration page since you don't need that information during registration. If you're the host, you also get a registration link that they can copy to the Meeting information page.",version 42.5,May-22,
"All new sites have this feature turned off by default. For existing sites that have entry and exit beep that is turned on, phone users continue to hear the beep, while it is turned off for computer audio users.",version 42.5,May-22,
"Scheduler on website for Meetings and Webinars is undergoing following UI enhancements: (1) A new section that is called Security is added and all scheduling options that are related to security are moved here. This includes passwords for meetings and webinars, (2) Tooltips are added to most scheduling options including options under Attendee privileges and Meeting options, and (3) Agenda is now part of the main or basic scheduling flow instead of under advanced options.",version 42.5,May-22,
"Music Mode now uses Fullband audio quality on Mac and Windows Meetings app, by default. Administrators that require the use of lower quality audio for Music Mode can request the feature toggle to be disabled for their site. By default, Music Mode sessions are encoded using up to Fullband audio quality. With this toggle disabled, Music Mode operates up to Superwideband audio fidelity on desktop clients. But Webex takes up more network bandwidth.",version 42.5,May-22,
"A user joining a meeting using Audio only (PSTN), can now be placed in a breakout session. This feature is available for meetings desktop and mobile.",version 42.5,May-22,
"When the practice session starts, attendees can now view an image that the host has uploaded. The host can upload an image before the webinar starts.",version 42.5,May-22,
We're adding the option to choose between the emoji and star scale.,version 42.5,May-22,
"With this update, collaboration restrictions can now be applied at an individual user and group level from the settings template in Control Hub. Today, IT administrators can block users from joining meetings that are hosted on the external sites at the org level only. With this update you can apply this policy at group and user level using settings template. Collaboration restrictions are applicable to the permitted sites too. The Settings template is applicable to your company user joining both internal meetings and external meetings, with separate collaboration restriction toggles. More than 20+ compliance control features are available for you to apply across your company users joining internal or external meetings. Users are provided with appropriate messaging while using Webex Meetings based on their company policy.",version 42.5,May-22,
IT administrators can now prevent users from joining company meetings from a BYOD. This feature leverages registry keys or tokens. Users can join your company meetings using BYOD only if a registry key or token is detected on that device.,version 42.5,May-22,
"In Control Hub, as an administrator, you can now lock the company device to allow only authenticated company users to join meetings using that device. This feature is applicable to your users using company device to join meetings that are held within your organization or joining external meetings (meetings held outside of your organization). This feature leverages the registry key and token that have already been introduced.",version 42.5,May-22,
"Administrators can now disable Broadcast Message using Control Hub templates for meetings and webinars. The control to disable this feature is available at the user, group, or org level. When the administrator has this feature disabled for the user, they won’t be able to receive broadcast message. The user as a host or cohost won’t be able to use the Broadcast Message feature in breakout rooms. The host and cohost are notified of the feature limitations.",version 42.5,May-22,
IT administrators can now set rules on who can join your company meetings. You can choose to allow anyone to join your internal meetings or choose to create an allowed list of domains. Only users who are authenticated on that domain can join your internal company meetings. This policy can be applied at the organization level. You can also choose to apply this policy at user and group level using the settings template in Control Hub. This feature is available for meetings desktop and mobile.,version 42.5,May-22,
"We’ve made interacting with shared content easier by moving the tools (from a fade-out side bar) into a dedicated toolbar above the stage so you can access it at any time. You can now see who's sharing content, zoom in or out, open the annotation tools, and more–without blocking your view of what's being shared.",version 42.4,Apr-22,
We are introducing the Move Meeting to Mobile feature where users can scan the QR code using their mobile camera and move their meeting to Webex Meetings mobile app without disrupting or disconnecting the meeting.,version 42.4,Apr-22,
"Host can enter a URL address when they set up the meeting or webinar. Attendees can now be forwarded to a landing page after a meeting or webinar ends. This is a way to direct your audience to a survey, invite to next meeting or webinar, a thank you page, or information on event sponsors. This provides the opportunity to keep the attendee engagement going even after the meeting or webinar has ended.",version 42.4,Apr-22,
Optimize for 3D is a new sharing optimization that is available to customers upon request to your Customer Success Manager. This feature uses additional bandwidth to reduce color artifacts when sharing high fidelity 3D models. The increased quality can aid in real-time collaboration for other types of content including Computer Aided Design and Medical Imaging.,version 42.4,Apr-22,
"This feature optimizes the Webex Meetings content sharing experience while sharing an application. Previously, when the user shared applications it would share the entire screen and mask areas outside of the application window. With this update, the receiving user sees the individual windows of the shared application and not the entire masked desktop screen.",version 42.4,Apr-22,
"In this update we’ve added a new Share tab to the Meeting Settings dialog. This is the new location for all relevant share-based preferences. One new setting is added for the Optimization for shared content. Currently, the Webex Meetings desktop app defaults to Automatically Optimize each time you share. Updating this preference allows you to control the default optimization that appears when the share dialog is opened. This feature is to unify fragmented sharing settings into the unified preference to align with the Webex App. It offers a new setting under sharing section to configure the by-default sharing type. This setting could be entered using the new setting icon on the sharing dialog.",version 42.4,Apr-22,
"A few visual and functional improvements are coming in March/April. As a presenter, you’ll be able to control the flow of incoming open-text responses more seamlessly. Also, we’re adding the option to display respondents’ names attached to their open-text answers. Respondents can decide if they want to submit their name or not, and the Slido administrator can decide if they want to allow the names when setting up the poll.",version 42.4,Apr-22,
"We've made some small, but effective changes to the style of the name labels in the video windows. So that they don't cover up as much, particularly in smaller window sizes. Name label styles are being updated to better align better with the rest of the Webex portfolio for users joining from video devices.",version 42.4,Apr-22,
"IT administrators can apply all e-compliance controls using templates in Control Hub at user, group, and org level for joining meetings from the Chrome browser. IT administrators can add the token to the new Chrome extension, then push the extension to all devices in the organization. All the compliance controls that are applicable to the user joining both internal and external meetings using the Webex Meetings desktop app are now applicable when they join meetings from the Chrome browser as well.",version 42.4,Apr-22,
"A host may schedule meetings but for some reason, can’t delete the meetings by themselves. For example, if the host leaves the company, then the administrator should have an ability to find the meetings and delete them. On Control Hub, the administrator can search for the scheduled meetings per the host user's name or meeting number, and then delete them.",version 42.4,Apr-22,
"Schedule meetings from the Webex messaging extension in channels, group chats, or private chats without having to install the Webex bot. When you schedule a meeting, the meeting information appears in the conversation or chat message for others to join from.",version 42.4,Apr-22,
Meetings Qualities API allows an administrator to pull detailed quality and troubleshooting information about a meeting (both recently occurred and currently occurring). This powerful API allows customers to create their own supportability tools and integration for their organization.,version 42.4,Apr-22,
"Speaker labels are added in the closed captioning box to further enhance live transcript readability. The closed captions feed behavior is also updated. More lines and up to two final utterances can be shown at once, depending on font size. Previous lines stay on screen, until new spoken lines push the script up.",version 42.3,Mar-22,
"In this update we're excited to introduce a new way to view Grid View, that maximizes screen space by using Artificial Intelligence to dynamically crop videos to focus on the individual, rather than their surroundings. You’ll get a better face-to-face experience and feel more connected, regardless of how they’re positioned in front of their camera. People focus can be turned on from the Layout menu when in Grid View and can be turned off at any time.",version 42.3,Mar-22,
"Hosts can download the in-webinar activity report for Q&A, chat, and polling for completed webinars. If Q&A or polling is done using Slido, hosts can find that information in Slido's report. This option is only available for recorded webinars. Webinars in webcast view also supports Q&A, chat, and polling.",version 42.3,Mar-22,
"When the host schedules a webinar, they can preassign panelists to different breakout sessions. Attendees can't be preassigned but they can join breakout sessions by clicking the join link. Hosts can create up to 100 breakout sessions. Each breakout session can host up to 1000 attendees.",version 42.3,Mar-22,
"In meetings, webinars, and events, you can filter out all background noises and enhance the voices of all users picked up by the microphone. The voice of the users that are farther away from the microphone are amplified to sound like they are much closer. This is done to create a better and more engaging experience during your meetings and events.",version 42.3,Mar-22,
"In order to enhance the clarity for people who are deaf or hard of hearing, we need to provide them with an option to display speaker labeling within the closed caption feed.",version 42.3,Mar-22,
"The volume balance in the simultaneous interpretation feature now shows interpreter on the right side instead of the left, so to hear the interpreter at a higher volume, users can slide the balance to the right.",version 42.3,Mar-22,
"Similar to desktop, Webex Meetings mobile app users can now enhance their meeting experience using Optimize for My Voice option. You can now suppress all background talkers and noise to allow others to hear you better, by selecting the option to Optimize for My Voice during a meeting by clicking More > Webex Smart Audio. Users can set their preference prior to a meeting by accessing Audio and Video menu in the app setting under the Webex Smart Audio section. The default option is Noise Removal that is enabled (previously, called Remove Background Noise).",version 42.3,Mar-22,
"IT administrators can make changes to meeting recordings such as reassigning to a new owner or deleting the recording file based on compliance regulations. In this update, we provide a setting at the site level for the IT administrators to notify the user when such actions take place.",version 42.3,Mar-22,
"In addition to polls using Slido, you can now start polls in webinars from the Polling panel, similar to Webex Meetings. Use polls to engage your participants, even if Slido is not available in your webinar. To pre-configure the polling questions the host can start any webinar to create questions and save the polling file in .atp format. During the webinar, the host can quickly add the questions by uploading the previously saved file.",version 42.3,Mar-22,
